Frank,Schirrmeister,CEO,Arvato,Arvato,frank.schirrmeister@arvato.com,Verified,Apollo,Apollo,"","",2026-01-18T15:26:31+00:00,C suite,C-Suite,wmarceau@marceausolutions.com,"","","",'+49 52 418040600,"",Cold,"","",wmarceau@marceausolutions.com,18000,logistics & supply chain,"supply chain management, logistics, fulfillment, transport, customs management, digital commerce, experience, transportation, logistics, supply chain & storage, business process outsourcing, artificial intelligence, digital campaign management, technology services, ai-powered logistics, cost reduction, digital transformation tools, technology-driven logistics, services, d2c, omnichannel fulfillment, banking and insurance, automated order processing, client partnerships, digital customer experience, cloud security, last mile delivery, multichannel logistics, public sector logistics, performance analytics, secure supply chain, supply chain optimization, logistics solutions, data analytics, smart material handling, it systems integration, transport management, customer communication platforms, iot solutions, real-time inventory tracking, order management, client-centric approach, digital logistics, consumer products, public sector, cloud computing, innovative logistics, healthcare logistics, sustainable supply chains, quality management, predictive analytics, automotive, regulatory compliance, long-term relationships, marketplace integration, performance monitoring, performance metrics, automation, healthcare, b2b, digital transformation, customer experience, transport networks, b2c, enterprise resource planning, digital workflow automation, ai, operational efficiency, digital solutions, it infrastructure, supply chain visibility, global logistics, value-added services, e-commerce, blockchain, iot, scalable logistics, customer relationship management, retail logistics, big data analytics, customized solutions, financial services, blockchain security, warehousing, e-commerce logistics, cloud-based applications, certified logistics, performance dashboards, retail, process automation, consulting, automotive logistics, entertainment, automated warehouses, management consulting services, government, sustainability, iot-enabled tracking, multi-cloud services, high-tech, warehouse automation, integrated logistics networks, inventory management, 3pl logistics, logistics services, fulfillment services, b2c logistics, b2b fulfillment, returns management, omnichannel distribution, warehouse management, freight control, carrier management, pharmaceutical distribution, medical device logistics, temperature-controlled transport, customer experience cloud, sales channel management, transport optimization, logistical transparency, financial services management, quality assurance, client management solutions, global logistics solutions, industrial logistics, retail fulfillment, fashion logistics, beauty supply chain, personalization services, customer communication, logistics network design, multi-channel distribution, service parts management, international logistics, manufacturing, supply chain, multichannel, omnichannel, logistics & supply chain, information technology & services, consumer goods, consumers, enterprise software, enterprises, computer software, health care, health, wellness & fitness, hospital & health care, consumer internet, internet, crm, sales, environmental services, renewables & environment, mechanical or industrial engineering",http://www.linkedin.com/in/frank-schirrmeister-9972331,https://arvato.com,http://www.linkedin.com/company/arvato,https://facebook.com/arvato.solutions/?rf=103767439661638,https://twitter.com/arvato_com,Bielefeld,North Rhine-Westphalia,Germany,"270 Carl-Bertelsmann-Strasse, Guetersloh, Nordrhein-Westfalen, Germany, 33335",Guetersloh,Nordrhein-Westfalen,Germany,'+49 52 418040600,"Outlook, Microsoft Office 365, Microsoft Application Insights, Atlassian Cloud, Afterpay, Figma, Adobe Marketing Cloud, Google Analytics, Zencoder, Google Tag Manager, EPiServer, Multilingual, Linkedin Marketing Solutions, Vimeo, DoubleClick, Marketo, Google Dynamic Remarketing, Mobile Friendly, DoubleClick Conversion, Google AdWords Conversion, Apache",3951000000,"","","","",Bertelsmann SE & Co. KGaA (bertelsmann.com),"",false,false,false,false,"",697cf795e8d26c00019a5074,697cf795e8d26c00019a5110,"","","","","","","","","","","","",""
Dewayne,Washington,Owner Operator,Hub Group,Hub Group,dewayne.washington@hubgroup.com,Verified,Apollo,Apollo,"","",2026-01-30T18:25:30+00:00,Owner,"",wmarceau@marceausolutions.com,"","","",'+1 630-271-3600,"",Cold,"","",wmarceau@marceausolutions.com,6400,transportation/trucking/railroad,"multimodal solutions, logistics, intermodal, trucking, final mile, managed solutions, transportation, international solutions, 3pl, lessthantruckload, brokerage, transportation management systems, integrated freight & logistics, industrials, truck transportation, b2b, digital freight solutions, transport safety, safety and fleet maintenance, automotive logistics, asset utilization optimization, less-than-truckload (ltl), supply chain transparency, sustainable logistics practices, supply chain risk management, international freight forwarding, asset-based transportation, ltl freight, international freight solutions, dedicated trucking, temperature-controlled freight, asset-based logistics, truck brokerage, intermodal transportation, intermodal logistics, transport optimization, railcar management, e-commerce, cost-effective intermodal, shipping solutions, automated freight matching, temperature-sensitive cargo, private fleet management, logistics software, intermodal container tracking, warehousing and distribution, cross-border transportation, warehousing, private fleet, real-time analytics, digital supply chain, last mile delivery, industry partnerships, e-commerce fulfillment, inventory management, asset-based trucking, automated freight management, supply chain technology, cloud logistics solutions, technology-driven logistics, asset solutions for 3pls, global shipping, real-time shipment visibility, freight cost optimization, dedicated fleet, reverse logistics, carrier network, last-mile delivery, retail supply chain, visibility platform, international shipping, temperature-controlled intermodal, private fleet logistics, supply chain optimization, logistics management, freight & shipping, temperature-controlled containers, full truckload (ftl), logistics innovation, retail logistics, supply chain visibility, global freight forwarding, logistics network, railcar management system, global freight, multi-modal transportation, transportation management system, technology platform, fleet management, general warehousing and storage, ai in logistics, retail, supply chain sustainability, real-time shipment tracking, carrier relationships, reverse logistics services, gps tracking, fleet safety technology, supply chain digitalization, fleet safety, supply chain management, cost-effective transportation, fleet maintenance, reverse logistics solutions, sustainable transportation, freight management, supply chain automation, services, customer service excellence, automotive supply chain, rail and truck integration, cross-border logistics, healthcare, transportation network, cross-border freight, full truckload, consulting, third-party logistics, supply chain resilience, freight optimization, e-commerce logistics solutions, full-service logistics provider, integrated supply chain, order fulfillment, cost efficiency, supply chain analytics, sustainability, cost reduction strategies, data-driven insights, freight consolidation services, cross-border shipping solutions, asset management, sustainable logistics, freight brokerage, rail logistics, safety protocols, warehousing solutions, third-party logistics (3pl), freight forwarding, last mile delivery technology, freight cost control, e-commerce logistics, carrier network management, fleet tracking, transportation & logistics, supply chain solutions, specialized equipment logistics, shipment tracking, logistics solutions, temperature-controlled logistics, marine container solutions, less-than truckload (ltl), final mile delivery, parcel management, ltl freight services, safety regulations, logistics technology, consolidation services, international freight shipping, parcel solutions, customized services, emergency freight services, expedited shipping, drayage services, high-value freight, healthcare logistics, food & beverage logistics, chemical logistics, 3pl services, sustainability practices, corporate social responsibility, warehouse management, freight visibility, logistics insights, on-time delivery, cost-effective solutions, transloading services, freight transportation, custom logistics solutions, carrier management, supply chain insights, manufacturing, distribution, consumer_products_retail, transportation_logistics, transportation/trucking/railroad, consumer internet, consumers, internet, information technology & services, logistics & supply chain, health care, health, wellness & fitness, hospital & health care, environmental services, renewables & environment, mechanical or industrial engineering",http://www.linkedin.com/in/dewayne-washington-31231996,https://hubgroup.com,http://www.linkedin.com/company/hub-group,https://www.facebook.com/HubGroupInc/,https://twitter.com/hubgroup,Charlotte,North Carolina,United States,"2000 Clearwater Dr, Oak Brook, Illinois, United States, 60523-8809",Oak Brook,Illinois,United States,'+1 630-271-3600,"Route 53, Outlook, Microsoft Office 365, Gmail, Google Apps, Rackspace MailGun, Pardot, OneTrust, Appcues, MongoDB, Slack, Hubspot, Pantheon, Atlassian Cloud, VueJS, Amazon SES, Mobile Friendly, Bootstrap Framework, reCAPTCHA, Google Font API, Google Maps, CrazyEgg, Google Maps (Non Paid Users), Typekit, Google Analytics, Gravity Forms, WordPress.org, Google Tag Manager, Simpli.fi, Linkedin Marketing Solutions, DoubleClick Conversion, DoubleClick, Google Dynamic Remarketing, Remote, Micro, Domo, AI, Gem, Omnitracs XRS, Microsoft Office, Google AdWords Conversion, Microsoft Excel, Microsoft Access, Microsoft Project, Microsoft PowerPoint, Salesforce, Oracle Cloud, REACH, Salesforce CRM Analytics, accessiBe, OpenProject, Tenstreet",3946390000,"","","","","","",false,false,false,false,"",697cf794e8d26c00019a502e,697cf795e8d26c00019a50e5,"","","","","","","","","","","","",""
Ronald,Tucker,Owner/Operator,Forward Air Corporation,Forward Air,rtucker@forwardair.com,Verified,Apollo,Apollo,"",Catch-all,2026-01-16T13:28:36+00:00,Owner,"",wmarceau@marceausolutions.com,"","","",'+1 800-726-6654,"",Cold,"","",wmarceau@marceausolutions.com,6400,transportation/trucking/railroad,"transportation, shipping, pool distribution services, freight management services, ltl, 3pl, linehaul, intermodal, cartage, airline logistics, truckload, driver jobs, owner operators, truck drivers, trucking jobs, coldchain, temperature controlled, integrated freight & logistics, industrials, truck transportation, shipping compliance, automotive supply chain, supply chain management, digital logistics tools, transport solutions, retail supply chain, shipping reliability, industrial freight services, transport network, edi integration, supply chain risk management, logistics industry, shipping technology, heavy machinery transport, logistics technology, billing and management systems, transportation services, specialized cargo handling, green logistics practices, shipping cost management, community engagement, full truckload, pharmaceutical logistics, cost-effective shipping, transportation network optimization, hazardous materials logistics, warehouse automation, integrated logistics services, fleet operations, shipping solutions, freight forwarding, veteran employment programs, shipping optimization, cost reduction strategies, technology-driven logistics, last mile delivery, intermodal logistics, transportation & logistics, multi-modal transportation, just-in-time delivery, supply chain efficiency, large volume freight, perishable cargo management, customized freight solutions, customized logistics planning, intermodal drayage, cargo safety, fleet management, supply chain solutions, time-sensitive shipping, north american logistics, cargo insurance, warehousing & distribution, cost-effective freight solutions, safety protocols, ground transportation, freight solutions, logistics innovation, logistics software, custom freight solutions, real-time tracking, intermodal services, community support initiatives, transport scheduling, freight capacity planning, expedited ltl, real-time shipment tracking, time-definite delivery, truckload services, final mile delivery, transport safety standards, medical equipment shipping, time-definite surface shipping, fleet maintenance, warehouse network, freight brokerage, general freight trucking, long-distance, supply chain visibility, logistics solutions, customer-centric logistics, intermodal container handling, sustainable transportation, ltl shipping, freight management, supply chain resilience, expedited freight services, cargo tracking, specialized freight handling, shipping industry, fleet tracking systems, perishable goods transportation, automotive logistics, carrier partnerships, transport services, customer service, cost efficiency, driver safety, logistics for retail industry, sustainable logistics, logistics analytics, supply chain logistics, logistics management, carrier network, urgent freight services, freight & shipping, shipping documentation, freight shipping, expedited shipping, ltl services, truckload solutions, intermodal transport, brokerage services, multi-modal delivery, scheduling services, routing optimization, freight tracking, shipping quotes, delivery management, custom shipping solutions, intact delivery rates, north american transportation, warehouse services, e-commerce shipping, industry-specific transport, sustainability initiatives, veteran support programs, transportation cost savings, on-time delivery, warehouse management system, customer service support, risk management, efficient transportation, long-haul shipping, regional delivery solutions, national coverage, freight handling services, automated shipment tracking, route planning, cargo insurance options, asset-based transportation, owner-operator partnerships, b2b shipping solutions, claims handling, b2b, e-commerce, healthcare, non-profit, manufacturing, distribution, consumer products & retail, logistics & supply chain, transportation/trucking/railroad, consumer internet, consumers, internet, information technology & services, health care, health, wellness & fitness, hospital & health care, nonprofit organization management, mechanical or industrial engineering",http://www.linkedin.com/in/ronald-tucker-b1561162,https://forwardair.com,http://www.linkedin.com/company/forward-air,https://facebook.com/drivefaf/,https://twitter.com/faf_inc,Lindale,Texas,United States,"1915 Snapps Ferry Rd, Greeneville, Tennessee, United States, 37745-3516",Greeneville,Tennessee,United States,'+1 800-726-6654,"Microsoft Azure Hosting, Outlook, Microsoft Office 365, Amazon AWS, Oracle Cloud, Salesforce Service Cloud, Salesforce, Salesforce Live Agent, Drupal, Slack, Vimeo, iGoDigital, Google Maps, Google Tag Manager, Google Places, Google Dynamic Remarketing, Cedexis Radar, Shutterstock, Ruxit, DoubleClick, Adobe Media Optimizer, Mobile Friendly, Google Font API, DoubleClick Conversion, Apache, ON24, Google Analytics, Google Maps (Non Paid Users), Remote, IoT, Microsoft Excel, Node.js, TypeScript, PostgreSQL, Oracle Analytics Cloud, Microsoft Sql Server, Docker, Kubernetes, Azure Functions, Azure Container Apps, Azure Service Bus, Azure Devops, PowerBI Tiles, SAP, Spiceworks IP Scanner, Microsoft PowerPoint, Qualcomm Snapdragon, Google Ads, DHL Global Forwarding, Omniture (Adobe), 24-7 Media, Rapid7 InsightVM, Tampa AS400 Inc, MEX Maintenance Software, Salesforce CRM Analytics, Microsoft Intune Enterprise Application Management, Microsoft Azure Monitor, Microsoft Exchange Server 2003, WMS, Atlas, Microsoft Office",2474262000,"","","","","","",false,false,false,false,3,697cf794e8d26c00019a5032,697cf795e8d26c00019a50de,"","","","","","","","","","","","",""
John,Ness,Owner / CEO at ODW Logistics,ODW Logistics,ODW Logistics,john.ness@odwlogistics.com,Verified,Apollo,Apollo,"","",2026-01-18T15:52:39+00:00,Owner,"C-Suite, Operations",wmarceau@marceausolutions.com,"","","",'+1 614-879-1681,"",Cold,"","",wmarceau@marceausolutions.com,1100,logistics & supply chain,"fulfillment, distribution, warehousing, transportation brokerage, ecommerce, assetbased transportation, transportation management, food grade certified, network analysis, cosmetics logistics, tier 2 manufacturing support, fast moving consumer packaged goods, retail logistics, omni channel fulfillment, contract logistics, reverse logistics, dedicated warehousing, nationwide warehousing, ecommerce fulfillment, freight brokerage, freight consolidation, transportation, logistics, supply chain & storage, cold chain logistics, cost reduction, supply chain cost savings, d2c, logistics automation, consumer packaged goods, retail, food and beverage logistics, logistics and supply chain management, general warehousing and storage, private equity supply chain, inventory accuracy, supply chain design, distribution centers, logistics software, real-time tracking, regional cold storage, automotive logistics, consulting, sustainable logistics practices, temperature-controlled storage, logistics innovation, transport mode optimization, b2b, inventory control, b2c, subscription-based fulfillment, cold chain solutions, inventory management, retail industry logistics, services, supply chain management, industrial logistics, supply chain optimization, customized logistics, supply chain consulting, real-time data, intermodal transportation, logistics technology, multi-channel distribution, transportation network, technology integration, logistics solutions, supply chain scalability, automated load planning, freight management, order fulfillment, automated inventory validation, supply chain analytics, sustainability initiatives, automated workflows, client-specific solutions, e-commerce, industry-specific compliance, automated warehouse, automated order picking, parcel program logistics, warehousing solutions, 3pl logistics, warehouse automation, warehousing and distribution, supply chain resilience, automated logistics, customized freight routing, supply chain transparency, automation technology, health and beauty logistics, cold storage, custom logistics solutions, cost efficiency, data analytics, freight planning, retail consolidation, strategic locations, warehouse management system, retail consolidation programs, industry-specific solutions, transportation optimization, distribution network, dedicated fleet, e-commerce fulfillment, supply chain visibility, operational efficiency, private equity logistics, integrated logistics solutions, 3pl services, supply chain innovation, warehouse management, process automation, dedicated fleet services, cold storage solutions, parcel program, vendor compliance, continuous improvement, strategic load planning, omnichannel distribution, consumer packaged goods logistics, health and beauty supply chain, industrial logistics solutions, cost reduction strategies, distribution and fulfillment, shipping solutions, risk management in logistics, collaborative supply chain, logistics strategy development, on-time delivery, efficient shipping solutions, inventory optimization, logistics cost control, scalable e-commerce solutions, custom supply chain design, transportation execution, supply chain modeling, demand forecasting, client engagement, integrated technology solutions, container management, last mile delivery solutions, logistics operational excellence, healthcare, food, manufacturing, automotive, private equity, automation, sustainability, customized solutions, industry-specific, consumer internet, consumers, internet, information technology & services, logistics & supply chain, health care, health, wellness & fitness, hospital & health care, consumer goods, mechanical or industrial engineering, financial services, environmental services, renewables & environment",http://www.linkedin.com/in/johnrness,https://odwlogistics.com,http://www.linkedin.com/company/odw-logistics-inc-,https://www.facebook.com/ODWLogistics/,https://twitter.com/odwlogistics,Columbus,Ohio,United States,"400 W Nationwide Blvd, Columbus, Ohio, United States, 43215",Columbus,Ohio,United States,'+1 614-879-1681,"Mailchimp Mandrill, Outlook, Microsoft Office 365, Drupal, Pantheon, The Trade Desk, Hubspot, Slack, Facebook Widget, Linkedin Login, Facebook Login (Connect), Google Tag Manager, Google Custom Search, DoubleClick, Mobile Friendly, Linkedin Widget, Google Dynamic Remarketing, Hotjar, DoubleClick Conversion, CallRail, Google Font API, Remote, UKG Wallet, Samsara, Gem, Microsoft Office, Infolinks, ServiceNow, Office365, Duo Security, HP LaserJet",685800000,"","","","","","",false,false,false,false,"",697cf794e8d26c00019a503a,697cf795e8d26c00019a50ee,"","","","","","","","","","","","",""
