First Name,Last Name,Title,Company Name,Company Name for Emails,Email,Email Status,Primary Email Source,Primary Email Verification Source,Email Confidence,Primary Email Catch-all Status,Primary Email Last Verified At,Seniority,Departments,Contact Owner,Work Direct Phone,Home Phone,Mobile Phone,Corporate Phone,Other Phone,Stage,Lists,Last Contacted,Account Owner,# Employees,Industry,Keywords,Person Linkedin Url,Website,Company Linkedin Url,Facebook Url,Twitter Url,City,State,Country,Company Address,Company City,Company State,Company Country,Company Phone,Technologies,Annual Revenue,Total Funding,Latest Funding,Latest Funding Amount,Last Raised At,Subsidiary of,Email Sent,Email Open,Email Bounced,Replied,Demoed,Number of Retail Locations,Apollo Contact Id,Apollo Account Id,Secondary Email,Secondary Email Source,Secondary Email Status,Secondary Email Verification Source,Tertiary Email,Tertiary Email Source,Tertiary Email Status,Tertiary Email Verification Source,Primary Intent Topic,Primary Intent Score,Secondary Intent Topic,Secondary Intent Score,Qualify Contact
Salvador,Martin Fernandez,CEO,Logistics Plus Inc.,Logistics Plus,salvador.martin@logisticsplus.com,Verified,Apollo,Apollo,"","",2026-01-13T10:05:25+00:00,C suite,C-Suite,wmarceau@marceausolutions.com,"","","",'+1 877-930-5623,"",Cold,"","",wmarceau@marceausolutions.com,1200,logistics & supply chain,"air, ocean freight forwarding, project cargo, project forwarding, ltl, truckload, customs brokerage, trade compliance, managedtransportation solutions, warehousing, distribution, 4pl & supply chain management, logistics, importer of record, imports, exports, fulfillment, transportation, logistics, supply chain & storage, sustainable supply chain, transportation & logistics, international freight, e-commerce logistics solutions, freight rate management, freight claims management, exhibit freight services, supply chain solutions, aerospace logistics, last mile delivery innovation, trade agreements, e-commerce, breakbulk logistics, hazardous materials shipping, project logistics, green logistics solutions, ai-powered logistics, supply chain visibility, global logistics, supply chain management, 3pl and 4pl, import and export services, ltl freight, mission-critical logistics, freight audit, cold chain logistics, perishable goods logistics, amazon fba services, supply chain optimization, cloud-based tms, services, technology, business intelligence (bi), white glove delivery for high-value items, cargo insurance, project cargo handling, port congestion map, inventory management, freight forwarding, logistics network design, cross-docking services, white glove delivery, trade tariffs & customs, shipment tracking, technology solutions, supply chain analytics, freight classification, manufacturing, dimensional freight, port services, logistics consulting, ai in logistics, warehousing & fulfillment, consulting, d2c, cross-border freight, business intelligence, logistics technology, incoterms guide, global trade compliance, freight audit solutions, last mile delivery, b2b, expedited freight, automotive logistics, wholesale, pharma supply chain, international trade facilitation, trade compliance consulting, global control towers, truckload & specialized freight, government, retail, bonded warehousing, cargo handling, managed transportation, heavy lift shipping, customs clearance automation, transportation management, global sourcing & procurement, cargo booking system, transport safety, general warehousing and storage, warehousing & distribution, 3pl services, 4pl services, global sourcing, truckload services, cross-border logistics, u.s. customs brokerage, warehouse management, fulfillment services, risk analysis, shipping logistics, international air freight, air charter services, international ocean freight, warehouse distribution, customs documentation, supplier diversity, ltl carriers, drayage services, intermodal transportation, mobile shipping application, e-commerce logistics, customs compliance, freight optimization, multi-modal logistics, logistics analytics, checkout solutions, healthcare, finance, non-profit, logistics & supply chain, consumer internet, consumers, internet, information technology & services, mechanical or industrial engineering, analytics, health care, health, wellness & fitness, hospital & health care, financial services, nonprofit organization management",http://www.linkedin.com/in/salvador-mart%c3%adn-fern%c3%a1ndez-20442131,https://logisticsplus.com,http://www.linkedin.com/company/logistics-plus,https://www.facebook.com/LogisticsPlus/,https://twitter.com/LogisticsPlus,Barcelona,Catalonia,Spain,"1406 Peach St, Erie, Pennsylvania, United States, 16501",Erie,Pennsylvania,United States,'+1 877-930-5623,"Constant Contact, Mimecast, Outlook, Amazon AWS, Slack, reCAPTCHA, DoubleClick, Google Font API, Google Tag Manager, Mobile Friendly, Gravity Forms, Facebook Login (Connect), YouTube, WordPress.org, Typekit, Hubspot, Vimeo, Nginx, Circle, Remote, Microsoft Excel, Google AdWords Conversion, Paycom, Neogov HRMS, BriteVerify, Gem, Salesforce CRM Analytics",600000000,"",Merger / Acquisition,0,2025-09-01T00:00:00+00:00,"","",false,false,false,false,2,697cf794e8d26c00019a502b,697cf795e8d26c00019a50e3,"","","","","","","","","","","","",""
Sidney,Brown,Chief Executive Officer,NFI,NFI,sidney.brown@nfiindustries.com,Verified,Apollo,Apollo,"",Catch-all,2026-01-22T14:11:56+00:00,C suite,C-Suite,wmarceau@marceausolutions.com,"","","",'+1 877-634-3777,"",Cold,"","",wmarceau@marceausolutions.com,17000,logistics & supply chain,"integrated supply chain solutions provider, logistics, distribution, warehousing, dedicated fleets, intermodal transportation, global logistics, commercial real estate, solar solutions, temperaturecontrolled supply chain, contract packaging, cross dock warehousing, drayage, brokerage, transportation, logistics, supply chain & storage, supply chain resilience, inventory management, customer-centric logistics, real estate development, sustainable logistics, warehouse automation, supply chain technology, sustainable transportation, ecommerce fulfillment, sustainability, supply chain solutions, supply chain optimization, warehouse robotics, transport management system, port services, transportation solutions, inventory visibility, consulting, multimodal transportation, global freight, customer service, trucking fleet, b2c, supply chain consulting, supply chain visibility, last mile delivery, multi-modal freight solutions, technology-enabled logistics, customized distribution centers, fleet tracking, logistics consulting, intermodal, supply chain risk management, transportation management software, north american logistics, transportation & logistics, electric vehicles, real estate, fleet management, last mile delivery solutions, family-owned logistics company, fleet conversion to electric vehicles, intermodal rail and truck, supply chain innovation, green logistics practices, fleet optimization, warehousing technology, b2b, port logistics management, industrial real estate development, logistics solutions, port logistics, food & beverage, real estate services, transportation, transportation management, port drayage, cross-docking solutions, general warehousing and storage, warehousing and distribution, manufacturing, industrial real estate, supply chain digital transformation, logistics industry awards, intermodal logistics, supply chain analytics, dedicated transportation, order fulfillment, supply chain sustainability, logistics services, customized solutions, customized logistics solutions, digital supply chain, automated warehousing, automation, logistics software, e-commerce, carrier network, port drayage services, services, integrated logistics services, freight brokerage, real estate solutions, supply chain management, automated warehouse solutions, warehouse management system, multi-channel distribution, automation in logistics, retail, d2c, integrated logistics, cross-docking, warehouse management, transload, private fleet solutions, returns management, customer experience, multichannel distribution, parcel management, shipping services, on-time delivery, operational excellence, safety standards, technology integration, cross-border transportation, freight management, integrated technology, customer support, tailored solutions, performance metrics, reverse logistics, operational synergies, logistics provider, cold storage solutions, shipping cost optimization, branding solutions, kitting, e-commerce logistics, safety compliance, vendor management, consumer products & retail, construction & real estate, logistics & supply chain, environmental services, renewables & environment, clean energy & technology, consumer goods, consumers, mechanical or industrial engineering, consumer internet, internet, information technology & services",http://www.linkedin.com/in/sidney-brown-47378579,https://nfiindustries.com,http://www.linkedin.com/company/nfi,https://facebook.com/NFIIndustries,https://twitter.com/nfiindustries,Philadelphia,Pennsylvania,United States,"2 Cooper St, Camden, New Jersey, United States, 08102",Camden,New Jersey,United States,'+1 877-634-3777,"Microsoft Office 365, Google Cloud Hosting, Brightcove, VueJS, Pantheon, Atlassian Cloud, Citrix NetScaler, iCIMS, Pardot, Hubspot, Salesforce, Gravity Forms, WordPress.org, Nginx, Mobile Friendly, UltiPro, Google Tag Manager, YouTube, Remote, IoT, Android, Circle, Azure Synapse Analytics, Azure Data Factory, Azure Data Lake Storage, Azure Databricks, Azure Machine Learning, Tor, Microsoft SQL Server Reporting Services, Git, Microsoft Excel, PowerBI Tiles, WMS, Ning, Gem, Javascript, TypeScript, React, Next.js, Node.js, .NET, C#, Microsoft Windows Server 2012, MercuryGate TMS, Carrier Hourly Analysis Program (HAP), SQL, FIS, AWS Identity and Access Management (IAM), Infinity Tracking, Yardi Voyager, Yardi Elevate, Linkedin Marketing Solutions, TikTok, Google Analytics, Kronos, WebOffice, Workday, Reltio Connected Data Platform, Azure Purview, Microsoft Azure Monitor, Azure Synapse, Azure Key Vault, TARGIT Decision Suite, Azure Information Protection",3600000000,"","","","","","",false,false,false,false,"",697cf794e8d26c00019a502c,697cf795e8d26c00019a50e4,"","","","","","","","","","","","",""
Vincent,Clerc,Chief Executive Officer,A.P. Moller - Maersk,A.P. Moller,vincent.clerc@maersk.com,Verified,Apollo,Apollo,"","",2026-01-11T15:53:42+00:00,C suite,C-Suite,wmarceau@marceausolutions.com,"","","",'+45 33 63 33 63,"",Cold,"","",wmarceau@marceausolutions.com,100000,logistics & supply chain,"container shipping, container terminals, retail, manufacturing, offshore, shipping, ports, logistics, warehousing, distribution, supply chain, integrated logistics, 4pl, cold chain solutions, transportation, logistics, supply chain & storage, logistics solutions, logistics innovation, consulting, services, port terminal operations, d2c, fleet management, supply chain solutions, global freight, ocean freight, innovation, sustainability in shipping, maritime logistics, transport services, freight forwarding, inventory management, freight management, deep sea, coastal, and great lakes water transportation, customer service, transportation services, transportation & logistics, shipping network, b2b, intermodal transport, cargo handling, shipping solutions, last mile delivery, shipping technology, shipping company, e-commerce, shipping routes, cargo transportation, sustainability, shipping industry, customs compliance, global trade routes, inland transportation, maritime shipping, global logistics network, maritime services, global trade, operational efficiency, predictive analytics, risk management, port operations, last-mile delivery, digitalization in logistics, container logistics, supply chain management, sustainability initiatives, cargo tracking, digital logistics, digital solutions, global network, freight booking, customs services, cold chain logistics, warehousing solutions, value-added services, data integration, emissions tracking, shipping documentation, automated processes, e-commerce fulfillment, less-than-container load, full container load, refrigerated transportation, cargo security, digital visibility, decarbonization, supply chain optimization, strategic hubs, transit reliability, customer insights, predictive vessel eta, real-time updates, service flexibility, efficient port calls, cargo monitoring, agile supply chain, dedicated experts, strategic partnerships, innovative networks, industry expertise, supply chain resilience, cargo insurance, b2c, mechanical or industrial engineering, logistics & supply chain, consumer internet, consumers, internet, information technology & services, environmental services, renewables & environment, enterprise software, enterprises, computer software, analytics",http://www.linkedin.com/in/vincent-clerc-56a7524,https://maersk.com,http://www.linkedin.com/company/maersk-group,https://facebook.com/Maersk,https://twitter.com/Maersk,Copenhagen,Capital Region of Denmark,Denmark,"50 Esplanaden, Kobenhavn, Denmark, 1263",Kobenhavn,"",Denmark,'+45 33 63 33 63,"Akamai, Akamai DNS, Outlook, Backbone JS Library, Drupal, VueJS, Microsoft Azure Monitor, Atlassian Cloud, Microsoft Power BI, Flutter, Mapbox, MongoDB, Workday, Slack, Amazon SES, Salesforce, Adobe Marketing Cloud, Shutterstock, UltiPro, Stripe, The Trade Desk, Mobile Friendly, Google Tag Manager, AppNexus, Microsoft-IIS, Google Play, LiveChat, Facebook Custom Audiences, Smartclip, DoubleClick Floodlight, Adobe Media Optimizer, reCAPTCHA, WordPress.org, Google Analytics Ecommerce Tracking, YouTube, Teads, Google Dynamic Remarketing, Bootstrap Framework, ASP.NET, Mixpanel, Cedexis Radar, Workday Recruit, Google AdSense, Facebook Widget, Linkedin Marketing Solutions, Google Analytics, Multilingual, DoubleClick Conversion, Google Font API, Vimeo, Google Maps, Decibel Insight, DoubleClick, JQuery 2.1.1, LiveRamp, Intercom, Facebook Login (Connect), SAP, MUI, Zoho CRM, Gem, PowerBI Tiles, Microsoft Excel, GoSquared, eMaint CMMS, Cisco VPN, Citrix, Microsoft Windows 10, Windows 11, E-planning, Microsoft Office 365, Google AdWords Conversion, accessiBe, SharePoint, Microsoft Teams Rooms, OpenProject, Visio, Kiosked, Android, Microsoft Active Directory Federation Services, ServiceNow, Siemens SIMATIC S7, Schneider Electric (Generic Product), Siemens SIMATIC HMI (Human Machine Interface), Siemens PROFIBUS, .NET, CANalyzer, WebOffice, Microsoft Office, Inductive Automation Ignition, Git, WMS, IBM Workload Scheduler, IFS, Oracle General Ledger, Google Identity Services APIs, IoT, Siemens SIMATIC SCADA, Power Query, SQL, Python, Databricks, Dremio, Taleo Applicant Tracking Systems (ATS), AutoCAD, mHelpDesk, PMWeb, Oracle Aconex, Relatics, pandas, NumPy, DAX, 3M Codefinder, SysTools VBA Password Recovery, MITRE ATT&CK, Microsoft PowerPoint, IFS Cloud, Ubuntu, AWS Greengrass, AutoStore Unify Analytics, Data Analytics, Quip, Spring Boot, React, Docker, Kubernetes, Azure Devops, Terraform, Jenkins, AWS SDK for JavaScript, HTML5 Maker, CSS, Javascript, Angular, MercuryGate TMS, PriceGrabber, AC500 PLC, Resi, Wider Planet, Salesforce CRM Analytics, Blender, Unity, SAP S/4HANA, Microsoft Project, Oracle Primavera, Next.js, Node.js, Redux, GitHub Actions, Redis, Google AlloyDB for PostgreSQL, Microsoft SQL Server Reporting Services, Remote, Azure Machine Learning, Azure Data Factory, Azure Web Apps, MLflow, Weights & Biases, Langchain, LlamaIndex, Pinecone, Thermo Scientific Chromeleon Chromatography Data System (CDS), Tor, SentenceTransformers, Azure Event Hubs, TensorFlow, PyTorch, JAX, scikit-learn, XGBoost, SYNCHRO Pro, REACH, Apple iPad, Microsoft Power Automate, Ning, ServiceNow Request Management, GRIN, 24-7 Media, McAfee VirusScan Enterprise, Faiss, OpenAI Whisper, Anthropic Claude, Hugging Face, Mist, Meta Llama 3, Mode, Shareworks by Morgan Stanley, ANGEL LMS, Azure Data Lake Storage, Milestone, Lytics, Mag+, Prisma, PostgreSQL, IDC, JWT, Blackline, OneStream, Cypress, Playwright, Selenium (Generic Product), GitLab, Grafana, ELK Stack, Apache Spark, Airflow, LeafLink, Hadoop HDFS, Apache Kafka, API Gateway, Microsoft Power Apps, Fusion ERP Analytics, Spring, Amazon Web Services (AWS), Google Cloud Platform, MySQL, CPMStar, Xray, Microsoft PowerShell, Ansible, Sensor Tower, Motorola, LogIC, python celery, Prometheus, Jupyter, aPriori Digital Manufacturing Simulation Software, Tealium iQ Tag Management, Microsoft.NET Core 3.1, C#, Apollo, Tableau, SAP Analytics Cloud, ACL, SAP HANA, SAP Fiori, SAP Cloud Platform Integration, CONTROL, Shareaholic Content Amplification, Dell iDRAC (Integrated Dell Remote Access Controller), 3M 360 Encompass - Health Analytics Suite, RabbitMQ, Autodesk BIM Collaborate, Kronos, PRTG Network Monitor, Catylist SiteLink, Star, Yammer, Cisco Nexus Switches, Connect, Compressor, comScore, CargoWise, Oracle XML DB, Act!, Mirantis Secure Registry (formerly Docker Trusted Registry), Flow, SolarWinds, VMware (Generic Product), Microsoft Application Insights, AI, MacStadium, Cloudwatch Logs connector for AWS Glue, ModSecurity, FedEx Ship Manager, GAS, Brocade Switches, Kotlin, Electron, BASE, Nevron Vision for SSRS, AMD Xilinx, Aspect Workforce, Archer, SAP BusinessObjects Business Intelligence (BI), Oracle WebLogic, CAT, MySQL 8 With RHEL 8, Azure Synapse Analytics, Spark, dbt, Delta Lake, AWS Glue Data Catalog, Semrush, Athena, Lambda Cloud, Aryson MySQL to MSSQL Converter, HighJump, Manhattan SCALE, Infor Birst, AVEVA PDMS, Oracle Fusion Middleware, DocuSign, Loopio, ALEX, Datonics, Oracle GRC, SendPulse, SAP Access Control, AWS Trusted Advisor, Rise, Sage Timeslips, ADP SmartCompliance®, Cisco ASA 5555, Moxa, Cisco Wireless LAN Controllers, requests, matplotlib, Seaborn Health Care, Plotly Dash, Thomson Reuters ONESOURCE, SAP SD, OpenText, AT&T, OneTrust Tech Risk & Compliance, UKG Dimensions Hourly Timekeeping, Dash, ADP, IBM Storage Suite for IBM Cloud Paks, Apache Iceberg, Metadata Hub, Open Policy Agent, Argo, Oracle Analytics Cloud, Axway, SAP Crystal Reports, Barracuda Email Security Service, Harness, Spring Cloud",49003000000,"","","","","","",false,false,false,false,"",697cf795e8d26c00019a5067,697cf795e8d26c00019a5108,"","","","","","","","","","","","",""
Wilfredo,Gonzalez,Owner Operator,Hub Group,Hub Group,wgonzalez@hubgroup.com,Verified,Apollo,Apollo,"","",2026-01-07T06:41:31+00:00,Owner,"",wmarceau@marceausolutions.com,"","","",'+1 630-271-3600,"",Cold,"","",wmarceau@marceausolutions.com,6400,transportation/trucking/railroad,"multimodal solutions, logistics, intermodal, trucking, final mile, managed solutions, transportation, international solutions, 3pl, lessthantruckload, brokerage, transportation management systems, integrated freight & logistics, industrials, truck transportation, b2b, digital freight solutions, transport safety, safety and fleet maintenance, automotive logistics, asset utilization optimization, less-than-truckload (ltl), supply chain transparency, sustainable logistics practices, supply chain risk management, international freight forwarding, asset-based transportation, ltl freight, international freight solutions, dedicated trucking, temperature-controlled freight, asset-based logistics, truck brokerage, intermodal transportation, intermodal logistics, transport optimization, railcar management, e-commerce, cost-effective intermodal, shipping solutions, automated freight matching, temperature-sensitive cargo, private fleet management, logistics software, intermodal container tracking, warehousing and distribution, cross-border transportation, warehousing, private fleet, real-time analytics, digital supply chain, last mile delivery, industry partnerships, e-commerce fulfillment, inventory management, asset-based trucking, automated freight management, supply chain technology, cloud logistics solutions, technology-driven logistics, asset solutions for 3pls, global shipping, real-time shipment visibility, freight cost optimization, dedicated fleet, reverse logistics, carrier network, last-mile delivery, retail supply chain, visibility platform, international shipping, temperature-controlled intermodal, private fleet logistics, supply chain optimization, logistics management, freight & shipping, temperature-controlled containers, full truckload (ftl), logistics innovation, retail logistics, supply chain visibility, global freight forwarding, logistics network, railcar management system, global freight, multi-modal transportation, transportation management system, technology platform, fleet management, general warehousing and storage, ai in logistics, retail, supply chain sustainability, real-time shipment tracking, carrier relationships, reverse logistics services, gps tracking, fleet safety technology, supply chain digitalization, fleet safety, supply chain management, cost-effective transportation, fleet maintenance, reverse logistics solutions, sustainable transportation, freight management, supply chain automation, services, customer service excellence, automotive supply chain, rail and truck integration, cross-border logistics, healthcare, transportation network, cross-border freight, full truckload, consulting, third-party logistics, supply chain resilience, freight optimization, e-commerce logistics solutions, full-service logistics provider, integrated supply chain, order fulfillment, cost efficiency, supply chain analytics, sustainability, cost reduction strategies, data-driven insights, freight consolidation services, cross-border shipping solutions, asset management, sustainable logistics, freight brokerage, rail logistics, safety protocols, warehousing solutions, third-party logistics (3pl), freight forwarding, last mile delivery technology, freight cost control, e-commerce logistics, carrier network management, fleet tracking, transportation & logistics, supply chain solutions, specialized equipment logistics, shipment tracking, logistics solutions, temperature-controlled logistics, marine container solutions, less-than truckload (ltl), final mile delivery, parcel management, ltl freight services, safety regulations, logistics technology, consolidation services, international freight shipping, parcel solutions, customized services, emergency freight services, expedited shipping, drayage services, high-value freight, healthcare logistics, food & beverage logistics, chemical logistics, 3pl services, sustainability practices, corporate social responsibility, warehouse management, freight visibility, logistics insights, on-time delivery, cost-effective solutions, transloading services, freight transportation, custom logistics solutions, carrier management, supply chain insights, manufacturing, distribution, consumer_products_retail, transportation_logistics, transportation/trucking/railroad, consumer internet, consumers, internet, information technology & services, logistics & supply chain, health care, health, wellness & fitness, hospital & health care, environmental services, renewables & environment, mechanical or industrial engineering",http://www.linkedin.com/in/wilfredo-gonzalez-872525a6,https://hubgroup.com,http://www.linkedin.com/company/hub-group,https://www.facebook.com/HubGroupInc/,https://twitter.com/hubgroup,Saint Charles,Missouri,United States,"2000 Clearwater Dr, Oak Brook, Illinois, United States, 60523-8809",Oak Brook,Illinois,United States,'+1 630-271-3600,"Route 53, Outlook, Microsoft Office 365, Gmail, Google Apps, Rackspace MailGun, Pardot, OneTrust, Appcues, MongoDB, Slack, Hubspot, Pantheon, Atlassian Cloud, VueJS, Amazon SES, Mobile Friendly, Bootstrap Framework, reCAPTCHA, Google Font API, Google Maps, CrazyEgg, Google Maps (Non Paid Users), Typekit, Google Analytics, Gravity Forms, WordPress.org, Google Tag Manager, Simpli.fi, Linkedin Marketing Solutions, DoubleClick Conversion, DoubleClick, Google Dynamic Remarketing, Remote, Micro, Domo, AI, Gem, Omnitracs XRS, Microsoft Office, Google AdWords Conversion, Microsoft Excel, Microsoft Access, Microsoft Project, Microsoft PowerPoint, Salesforce, Oracle Cloud, REACH, Salesforce CRM Analytics, accessiBe, OpenProject, Tenstreet",3946390000,"","","","","","",false,false,false,false,"",697cf795e8d26c00019a5085,697cf795e8d26c00019a50e5,"","","","","","","","","","","","",""
