Ken,Wood,Founder & Chief Executive Officer,LJM,LJM,kenwood@myljm.com,Verified,Apollo,Apollo,"","",2026-01-01T15:21:44+00:00,Founder,C-Suite,wmarceau@marceausolutions.com,"","","",'+1 631-844-9500,"",Cold,"","",wmarceau@marceausolutions.com,48,logistics & supply chain,"shipping solution provider, shipping cost reduction, datadriven shipping solutions, ecommerce shipping solutions, carrier relationship management, logistics optimization, personalized shipping consulting, shipping cost analysis, shipping spend optimization, shipping insights, small parcel contract negotiation, small parcel auditing, parcel invoice auditing, concierge solutions, shipping logistics partners, executive advisory, parcel spend optimization, transportation, logistics, supply chain & storage, data-driven decisions, dynamic rate calculation, consulting, executive shipping advisory, shipping cost optimization, services, invoice audit, contract negotiation, management consulting services, business intelligence, operational efficiency, distribution, performance monitoring, cost reduction strategies, parcel spend management, rate optimization, parcel data analytics, transportation & logistics, b2b, shipspend proficiency score (sps), fraud detection in shipping, e-commerce, operational visibility, invoice auditing, real-time shipping insights, ai-powered analytics, parcel intelligence platform, carrier contract negotiation, fraud detection, logistics & supply chain, analytics, information technology & services, consumer internet, consumers, internet, computer & network security",http://www.linkedin.com/in/ken-wood-249a899,https://myljm.com,http://www.linkedin.com/company/ljmgroup,https://www.facebook.com/LJMGroup,https://twitter.com/LJMConsultants,Garden City,New York,United States,"312 Conklin St, Farmingdale, New York, United States, 11735",Farmingdale,New York,United States,'+1 631-844-9500,"Cloudflare DNS, TurboSMTP, Constant Contact, Outlook, Backbone JS Library, UPS, The Trade Desk, Hubspot, Slack, WordPress.org, Google Tag Manager, OpenSSL, Facebook Custom Audiences, Google Dynamic Remarketing, DoubleClick, Google AdWords Conversion, Visual Visitor, YouTube, Mobile Friendly, Facebook Login (Connect), Facebook Widget, Gravity Forms, Google Analytics, Linkedin Marketing Solutions, Apache, Google Font API, reCAPTCHA, DoubleClick Conversion, Android, AI",1051000,"","","","","","",false,false,false,false,"",697cf795e8d26c00019a506c,697cf795e8d26c00019a510c,"","","","","","","","","","","","",""
Stephen,Isaf,Founder and CEO,"Interra International, LLC.",Interra International,sisaf@interrainternational.com,Verified,Apollo,Apollo,"","",2026-01-09T12:06:13+00:00,Founder,C-Suite,wmarceau@marceausolutions.com,"","","",'+1 770-612-8101,"",Cold,"","",wmarceau@marceausolutions.com,150,international trade & development,"chicken, poultry, turkey, pork, beef, meat products, dairy, cheese, sugar, rice, grains, edible oils, tree nuts, feed ingredients, wholesale distributor, logistic, risk management, supply chain, food ingredients, wholesale food distributor, quality assurance, price optimization, export, traceability, logistics & supply chain, consumer-packaged goods, diverse sourcing, foodservice industry, food supply chain, protein foods, market information, retail distribution, cultural sensitivity, global trade, timely market insights, food industry partnerships, supply chain management, b2b, multinational team, real-time pricing, nuts, food safety, other grocery and related products merchant wholesalers, proprietary platform, ingredients, logistics, distribution, product sourcing, food products, international trade compliance, market disparities, market adaptability, customized solutions, food export, food logistics technology, retail, food industry, services, market trends, global sourcing, animal proteins, food industry innovation, distribution solutions, food distribution, wholesale food, global infrastructure, non-profit, transportation & logistics, international trade & development, nonprofit organization management, computers, shopping",http://www.linkedin.com/in/stephen-isaf-271329303,https://interrainternational.com,http://www.linkedin.com/company/interra-international,https://www.facebook.com/Interra-International-LLC-170902856291433/,https://twitter.com/Interra_Food,Atlanta,Georgia,United States,"400 Interstate North Pkwy SE, Atlanta, Georgia, United States, 30339",Atlanta,Georgia,United States,'+1 770-612-8101,"Outlook, Microsoft Office 365, WordPress.org, Hotjar, Google Tag Manager, Google Font API, reCAPTCHA, Mobile Friendly, YouTube",173000000,"","","","","","",false,false,false,false,2,697cf794e8d26c00019a5038,697cf795e8d26c00019a50ec,"","","","","","","","","","","","",""
Russell,Leo,Chief Executive Officer,RLS Logistics,RLS Logistics,rleo@rlslogistics.com,Verified,Apollo,Apollo,"","",2026-01-06T17:27:18+00:00,C suite,C-Suite,wmarceau@marceausolutions.com,"","","",'+1 856-694-3216,"",Cold,"","",wmarceau@marceausolutions.com,410,logistics & supply chain,"temperaturecontrolled thirdparty logistics, transportation, cold storage warehousing, packaging, freight consolidation, cold chain logistics, freight brokerage, ecommerce, fulfillment, 3pl, cold chain ltl, repack, truckload, frozen fulfillment, transportation, logistics, supply chain & storage, ltl shipping, transportation & logistics, refrigerated and frozen foods, energy-efficient warehouses, cost savings, d2c, value-added services, inventory management, sustainability, temperature-controlled logistics, truckload services, cross docking, brc-global standard certified, b2b, e-commerce, cold chain solutions, warehouse management, d2c fulfillment, solar energy systems, third-party logistics, ecommerce fulfillment, refrigerated warehousing and storage, food & beverage, food safety, b2c, custom cold chain solutions, retail, last mile delivery, transportation services, vendor consolidation, co2 refrigeration, services, supply chain management, manufacturing, distribution, shipping, logistics & supply chain, consumer internet, consumers, internet, information technology & services, environmental services, renewables & environment, consumer goods, mechanical or industrial engineering",http://www.linkedin.com/in/russleo,https://rlslogistics.com,http://www.linkedin.com/company/rls-logistics,https://www.facebook.com/rlslogistics,https://twitter.com/rlslogistics,Glassboro,New Jersey,United States,"Monroeville-Glassboro Rd, Glassboro, New Jersey, United States, 08028",Glassboro,New Jersey,United States,'+1 856-694-3216,"Mailchimp Mandrill, Sendgrid, Mimecast, Outlook, Brightcove, Oracle Cloud, Microsoft Application Insights, Zoho SalesIQ, Microsoft Azure, Sage Intacct, Slack, Google Font API, Google Maps, Google Tag Manager, Microsoft-IIS, WordPress.org, Mobile Friendly, Google Maps (Non Paid Users), Bootstrap Framework, YouTube, ASP.NET, Android, Remote",60000000,7229876,Other,7229876,2023-03-01T00:00:00+00:00,"","",false,false,false,false,"",697cf795e8d26c00019a5056,697cf795e8d26c00019a5100,"","","","","","","","","","","","",""
Ananta,Islam,Chief Executive Officer,Körber Supply Chain,Körber Supply Chain,ananta.islam@koerber.com,Verified,Apollo,Apollo,"",Not Catch-all,2026-01-16T06:43:16+00:00,C suite,C-Suite,wmarceau@marceausolutions.com,"","","",'+49 6032 3485900,"",Cold,"","",wmarceau@marceausolutions.com,2700,logistics & supply chain,"supply chain solutions, system integration, endtoend supply chain solutions, automation solutions, mail, parcel solutions, palletizing, sap consulting, implementation, transportation, logistics, supply chain management, storage, information technology, automotive, transportation, logistics, supply chain & storage, data analytics, sustainability, supply chain technology, inventory management, distribution automation, process optimization, order fulfillment, b2c, ai-powered warehouse management, distribution center automation, supply chain machine learning, supply chain iot, supply chain analytics, automation, pharmaceutical logistics automation, supply chain services, manufacturing, e-commerce, autonomous mobile robots, operational efficiency, pharmaceuticals, automated storage and retrieval systems (asrs), supply chain resilience, services, supply chain data management, predictive maintenance, regulatory compliance, supply chain optimization, parcel and postal automation, sap integration, retail, supply chain visibility, stacker cranes, supply chain digital solutions, supply chain execution, retail warehouse automation, supply chain sustainability solutions, logistics software, warehouse management system, engineering services, robotics, warehouse control systems (wcs), supply chain consulting, cloud-based supply chain, material handling, supply chain digital transformation, sap ewm integration, warehouse automation, inventory tracking iot, e-commerce logistics automation, consulting, palletizing solutions, automated storage systems, automated guided vehicles (agvs), supply chain digitalization, autonomous mobile robots (amrs), smart warehousing, robotics in logistics, supply chain efficiency, cold chain automation, b2b, robotics-as-a-service (raas), d2c, warehouse monitoring software, supply chain innovation, supply chain predictive analytics, palletizing robots, supply chain planning, supply chain strategy, ai in logistics, material flow automation, supply chain automation, supply chain automation software, supply chain cloud solutions, logistics optimization, automated sorting systems, real-time tracking, smart logistics solutions, supply chain ai solutions, supply chain digital twin, warehouse control system, ai-driven automation, digital transformation, supply chain software, robotics integration, software as a service, order picking robots, real-time supply chain visibility, logistics analytics, supply chain performance management, palletizing systems, automated guided vehicles, material handling solutions, robotic solutions, software integration, parcel sorting solutions, voice-directed picking, digital supply chain, manufacturing logistics, crossbelt sorters, dynamic picking solutions, transport management, sap supply chain solutions, end-to-end integration, smart maintenance services, material handling equipment, picking optimization, mobility solutions, system design and testing, automated storage and retrieval, pallet handling, parcel data management, inventory management systems, logistics automation, scalable warehouse solutions, dynamic handling systems, cloud-based solutions, customer support services, integrated supply chain solutions, sustainability in logistics, future-proofing supply chains, e-commerce fulfillment, performance analytics, retail solutions, steplogic serialization, fast induction systems, smart service solutions, robotics as a service (raas), warehouse management software (wms), end-to-end supply chain solutions, healthcare, software, ai, digitalization, sap, cold chain, pharmaceutical, distribution, scalability, logistics & supply chain, environmental services, renewables & environment, mechanical or industrial engineering, consumer internet, consumers, internet, information technology & services, medical, saas, computer software, health care, health, wellness & fitness, hospital & health care",http://www.linkedin.com/in/ananta-islam-89580aaa,https://koerber-supplychain.com,http://www.linkedin.com/company/koerber-supply-chain,http://www.facebook.com/AccellosInc,http://www.twitter.com/AccellosInc,Baltimore,Maryland,United States,"16/18 Lilienthalstrasse, Konstanz, Baden-Wuerttemberg, Germany, 78467",Konstanz,Baden-Wuerttemberg,Germany,'+49 6032 3485900,"Outlook, Microsoft Office 365, Gmail, Google Apps, Amazon AWS, Route 53, MailChimp SPF, Drift, React, Atlassian Cloud, Magento, Mobile Friendly, New Relic, Linkedin Marketing Solutions, Facebook Widget, Google Dynamic Remarketing, Google Maps, Vimeo, YouTube, Google Tag Manager, Apache, Cvent, DoubleClick, Google Font API, Facebook Custom Audiences, Facebook Login (Connect), Wistia, Google Analytics, Bootstrap Framework, Amcharts JS Library, DoubleClick Conversion, Hubspot, Nginx, Cedexis Radar, Adobe Media Optimizer, Remote, Circle, AI",1100000000,"",Venture (Round not Specified),"",2021-12-01T00:00:00+00:00,Körber (koerber.com),"",false,false,false,false,"",697cf795e8d26c00019a5072,697cf795e8d26c00019a50df,"","","","","","","","","","","","",""
Rob,McKeel,Chief Executive Officer,FORTNA,FORTNA,robmckeel@fortna.com,Verified,Apollo,Apollo,"","",2026-01-16T10:47:34+00:00,C suite,C-Suite,wmarceau@marceausolutions.com,"","","",'+1 610-370-8000,"",Cold,"","",wmarceau@marceausolutions.com,1700,logistics & supply chain,"organizational excellence, supply chain consulting, distribution center design, materials handling, lean distribution, distribution center operations, supply chain systems, supply chain strategy, transportation, logistics, supply chain & storage, project management, supply chain resilience, network strategy, warehouse software, sortation technology, cloud-based software, electronics, consulting, last mile delivery, warehouse safety systems, data-driven solutions, automation control, engineering services, warehouse footprint reduction, robotics integration, end-of-line automation, supply chain performance metrics, micro-fulfillment centers, logistics software, inventory management, real-time decision making, automated storage, project management software, services, digital transformation, omnichannel fulfillment, food and beverage, agv and amr solutions, ai-driven logistics planning, scalability, ai-powered warehouse analytics, next-generation warehouse software, robotic systems, supply chain digital twin, autostore systems, industrial automation, conveyor systems, inventory management software, supply chain visibility, inventory orchestration software, healthcare, supply chain disruption management, supply chain optimization, system integration, retail, material handling automation, warehouse control systems, distribution center modernization, operations design, automated material handling, material flow optimization, warehouse management, custom engineering, lifecycle services, automated returns processing, distribution automation, goods-to-person (gtp) systems, logistics, performance optimization, robotics and automation integration, material handling systems, d2c, supply chain network modeling, operational efficiency, supply chain solutions, software solutions, real-time warehouse control, intelligent software, automation technology, warehouse execution system, ai algorithms, supply chain analytics, distribution network resilience, b2c, e-commerce, b2b, manufacturing, distribution network design, end-to-end distribution, supply chain software, high-density storage solutions, order fulfillment software, software customization, automated picking solutions, system modernization, smart warehouse design, sortation systems, warehouse automation, software development, industrial distribution, autonomous flow wes, warehouse optimization, distribution strategy, automation technologies, material handling solutions, e-commerce fulfillment, cross-docking, high-density storage, micro-fulfillment, goods-to-person systems, automated storage and retrieval systems, robotics in warehousing, sorting systems, optimization assessments, robotic process automation, warehouse execution systems, slotting strategies, dynamic data analysis, material handling equipment, advanced picking technologies, integration solutions, data science methodology, custom warehouse solutions, third party logistics (3pl), aftermarket parts management, consumer packaged goods logistics, food and beverage distribution, life sciences and healthcare logistics, parcel distribution solutions, industrial distribution strategies, safety enhancements in warehousing, maintenance and support services, training for warehouse operations, operational efficiency improvement, sustainability initiatives in supply chain, vendor-agnostic solutions, compliance and policies in logistics, emerging supply chain technologies, continuous improvement culture, cross-industry solutions, business process automation, software, automation, robotics, supply chain, material handling, real-time decision, distribution center, automation systems, ai-powered analytics, disruption management, logistics & supply chain, productivity, computer hardware, hardware, information technology & services, food & beverages, consumer goods, consumers, mechanical or industrial engineering, health care, health, wellness & fitness, hospital & health care, consumer internet, internet",http://www.linkedin.com/in/rob-mckeel,https://fortna.com,http://www.linkedin.com/company/fortna,https://facebook.com/FortnaInc/,https://twitter.com/fortnainc/,Woodstock,Georgia,United States,"1349 W Peachtree St NE, Atlanta, Georgia, United States, 30309-2912",Atlanta,Georgia,United States,'+1 610-370-8000,"Mimecast, Microsoft Office 365, WP Engine, Atlassian Cloud, Citrix, OneTrust, Workday, Remote, Marketo, YouTube, Mobile Friendly, Workday Recruit, Google Tag Manager, Shutterstock, WordPress.org, Node.js, Android, IoT, Sisense, Domo, BigCommerce",745000000,"",Merger / Acquisition,0,2022-04-01T00:00:00+00:00,"","",false,false,false,false,"",697cf795e8d26c00019a5080,697cf795e8d26c00019a5116,ram360@roadrunner.com,Apollo,Verified,Apollo,"","","","","","","","",""
Mike,Lambert,Chief Executive Officer,Green Mountain,Green Mountain,mlambert@greenmountaintechnology.com,Verified,Apollo,Apollo,"","",2026-01-29T18:07:04+00:00,C suite,C-Suite,wmarceau@marceausolutions.com,"","","",'+1 877-397-2834,"",Cold,"","",wmarceau@marceausolutions.com,170,logistics & supply chain,"parcel spend management, contract management, parcel auditing, network optimization, spend analytics, transportation, logistics, supply chain & storage, data re-rating, carrier contract strategy, management consulting services, network planning, shipping network optimization, logistics optimization, transportation & logistics, business intelligence, data analytics, carrier portfolio management, parcel audit, distribution, big data in logistics, retail, carrier management, b2b, real-time performance monitoring, cost allocation, operational and financial optimization, consulting, dispute resolution, parcel network digital twins, supply chain disruption management, data management, e-commerce, d2c, services, volume surge planning, predictive modeling, logistics & supply chain, analytics, information technology & services, conflict resolution, consumer internet, consumers, internet",http://www.linkedin.com/in/mike-l-499275,https://greenmt.com,http://www.linkedin.com/company/greenmountain,"","",Memphis,Tennessee,United States,"5860 Ridgeway Center Pkwy, Memphis, Tennessee, United States, 38120",Memphis,Tennessee,United States,'+1 877-397-2834,"Outlook, Pardot, Slack, WP Engine, Atlassian Cloud, Microsoft Azure, WordPress.org, Google Analytics, Mobile Friendly, Bing Ads, reCAPTCHA, Gravity Forms, Google Tag Manager, Typekit, Linkedin Marketing Solutions, Remote",35000000,"",Venture (Round not Specified),"",2020-02-01T00:00:00+00:00,"","",false,false,false,false,"",697cf794e8d26c00019a5037,697cf795e8d26c00019a50eb,"","","","","","","","","","","","",""
Buck,Buchanan,Owner Operator,Hub Group,Hub Group,bbuchanan@hubgroup.com,Verified,Apollo,Apollo,"","",2026-01-20T21:03:12+00:00,Owner,"",wmarceau@marceausolutions.com,"","","",'+1 630-271-3600,"",Cold,"","",wmarceau@marceausolutions.com,6400,transportation/trucking/railroad,"multimodal solutions, logistics, intermodal, trucking, final mile, managed solutions, transportation, international solutions, 3pl, lessthantruckload, brokerage, transportation management systems, integrated freight & logistics, industrials, truck transportation, b2b, digital freight solutions, transport safety, safety and fleet maintenance, automotive logistics, asset utilization optimization, less-than-truckload (ltl), supply chain transparency, sustainable logistics practices, supply chain risk management, international freight forwarding, asset-based transportation, ltl freight, international freight solutions, dedicated trucking, temperature-controlled freight, asset-based logistics, truck brokerage, intermodal transportation, intermodal logistics, transport optimization, railcar management, e-commerce, cost-effective intermodal, shipping solutions, automated freight matching, temperature-sensitive cargo, private fleet management, logistics software, intermodal container tracking, warehousing and distribution, cross-border transportation, warehousing, private fleet, real-time analytics, digital supply chain, last mile delivery, industry partnerships, e-commerce fulfillment, inventory management, asset-based trucking, automated freight management, supply chain technology, cloud logistics solutions, technology-driven logistics, asset solutions for 3pls, global shipping, real-time shipment visibility, freight cost optimization, dedicated fleet, reverse logistics, carrier network, last-mile delivery, retail supply chain, visibility platform, international shipping, temperature-controlled intermodal, private fleet logistics, supply chain optimization, logistics management, freight & shipping, temperature-controlled containers, full truckload (ftl), logistics innovation, retail logistics, supply chain visibility, global freight forwarding, logistics network, railcar management system, global freight, multi-modal transportation, transportation management system, technology platform, fleet management, general warehousing and storage, ai in logistics, retail, supply chain sustainability, real-time shipment tracking, carrier relationships, reverse logistics services, gps tracking, fleet safety technology, supply chain digitalization, fleet safety, supply chain management, cost-effective transportation, fleet maintenance, reverse logistics solutions, sustainable transportation, freight management, supply chain automation, services, customer service excellence, automotive supply chain, rail and truck integration, cross-border logistics, healthcare, transportation network, cross-border freight, full truckload, consulting, third-party logistics, supply chain resilience, freight optimization, e-commerce logistics solutions, full-service logistics provider, integrated supply chain, order fulfillment, cost efficiency, supply chain analytics, sustainability, cost reduction strategies, data-driven insights, freight consolidation services, cross-border shipping solutions, asset management, sustainable logistics, freight brokerage, rail logistics, safety protocols, warehousing solutions, third-party logistics (3pl), freight forwarding, last mile delivery technology, freight cost control, e-commerce logistics, carrier network management, fleet tracking, transportation & logistics, supply chain solutions, specialized equipment logistics, shipment tracking, logistics solutions, temperature-controlled logistics, marine container solutions, less-than truckload (ltl), final mile delivery, parcel management, ltl freight services, safety regulations, logistics technology, consolidation services, international freight shipping, parcel solutions, customized services, emergency freight services, expedited shipping, drayage services, high-value freight, healthcare logistics, food & beverage logistics, chemical logistics, 3pl services, sustainability practices, corporate social responsibility, warehouse management, freight visibility, logistics insights, on-time delivery, cost-effective solutions, transloading services, freight transportation, custom logistics solutions, carrier management, supply chain insights, manufacturing, distribution, consumer_products_retail, transportation_logistics, transportation/trucking/railroad, consumer internet, consumers, internet, information technology & services, logistics & supply chain, health care, health, wellness & fitness, hospital & health care, environmental services, renewables & environment, mechanical or industrial engineering",http://www.linkedin.com/in/buck-buchanan-7b9282108,https://hubgroup.com,http://www.linkedin.com/company/hub-group,https://www.facebook.com/HubGroupInc/,https://twitter.com/hubgroup,Roseville,Michigan,United States,"2000 Clearwater Dr, Oak Brook, Illinois, United States, 60523-8809",Oak Brook,Illinois,United States,'+1 630-271-3600,"Route 53, Outlook, Microsoft Office 365, Gmail, Google Apps, Rackspace MailGun, Pardot, OneTrust, Appcues, MongoDB, Slack, Hubspot, Pantheon, Atlassian Cloud, VueJS, Amazon SES, Mobile Friendly, Bootstrap Framework, reCAPTCHA, Google Font API, Google Maps, CrazyEgg, Google Maps (Non Paid Users), Typekit, Google Analytics, Gravity Forms, WordPress.org, Google Tag Manager, Simpli.fi, Linkedin Marketing Solutions, DoubleClick Conversion, DoubleClick, Google Dynamic Remarketing, Remote, Micro, Domo, AI, Gem, Omnitracs XRS, Microsoft Office, Google AdWords Conversion, Microsoft Excel, Microsoft Access, Microsoft Project, Microsoft PowerPoint, Salesforce, Oracle Cloud, REACH, Salesforce CRM Analytics, accessiBe, OpenProject, Tenstreet",3946390000,"","","","","","",false,false,false,false,"",697cf795e8d26c00019a5053,697cf795e8d26c00019a50e5,"","","","","","","","","","","","",""
