Andreas,Raptopoulos,Founder & CEO,Matternet,Matternet,andreas@matternet.us,Verified,Apollo,Apollo,"",Not Catch-all,2026-01-10T23:29:55+00:00,Founder,C-Suite,wmarceau@marceausolutions.com,"","","",'+1 650-260-2727,"",Cold,"","",wmarceau@marceausolutions.com,50,logistics & supply chain,"unmmaned aerial systems, aerial robotics, logistics, drones, delivery, transportation, consumer electronics, robotics, information technology, hardware, aerospace, transportation, logistics, supply chain & storage, b2c, medical delivery drones, drone landing stations, integrated delivery network, real-time flight monitoring, drone route planning, operational efficiency, medical supply delivery, d2c, logistics software, e-commerce, services, remote patient monitoring, autonomous drone delivery, retail, drone safety systems, rural delivery solutions, urban and suburban delivery, government, autonomous drones, aerospace product and parts manufacturing, inventory management, drone flight authorization, drone fleet management, low-cost delivery drones, food delivery, remote drone operation, healthcare technology, bvlos operations, innovation, drone delivery pilot programs, b2b, healthcare drone network, drone delivery system, faa type certification, last-mile delivery, global drone network, remote healthcare logistics, payload system, battery swapping stations, logistics and supply chain management, drone logistics platform, cloud-based flight control, sustainable urban logistics, automated loading and unloading, regulatory compliance, urban drone delivery, sustainability, aerospace manufacturing, zero-emission delivery, city logistics innovation, regulatory approvals, drone delivery certification, drone payloads, drone network infrastructure, city-wide drone operations, e-commerce drone delivery, bvlos drone flights, medical specimen transport, drone delivery, autonomous delivery, healthcare logistics, ultra-fast delivery, same-day delivery, medical sample transport, e-commerce logistics, urban delivery networks, automated workflows, logistics innovation, food delivery logistics, pharmacy delivery, lab services, just-in-time delivery, environmental impact, traffic congestion solution, insurance logistics, temperature-controlled transport, unmanned aerial vehicles, aircraft landing station, software platform, regulated airspace operations, local economies, community development, international partnerships, remote healthcare access, medical supply chains, home delivery service, automated charging station, dispatch software, generic medicine delivery, emergency response logistics, healthcare compliance, commercial drone operations, real-time tracking, flight operations management, payload capacity, delivery drones, urban infrastructure, sustainability in logistics, drone safety compliance, automated logistics solutions, patient care improvements, drone network expansion, healthcare, autonomous systems, bvlos, urban delivery, remote area delivery, regulatory approval, cloud logistics, zero emissions, smart city, medical logistics, supply chain automation, city-wide network, safety certification, drone infrastructure, autonomous aircraft, delivery automation, sustainable delivery, drone software, urban logistics, remote healthcare, aviation & aerospace, information technology & services, consumers, mechanical or industrial engineering, logistics & supply chain, consumer internet, internet, environmental services, renewables & environment, health care, health, wellness & fitness, hospital & health care",http://www.linkedin.com/in/andreasraptopoulos,https://matternet.com,http://www.linkedin.com/company/matternet-inc,https://www.facebook.com/matternet,https://twitter.com/matternet,Palo Alto,California,United States,"185 E Dana St, Mountain View, California, United States, 94041-1507",Mountain View,California,United States,'+1 650-260-2727,"NSOne, Gmail, Google Apps, Microsoft Office 365, Route 53, Amazon AWS, Zendesk, Slack, Media Temple SSL, Android, Sigma, AI, Remote, CANalyzer, Quartic, Cross Pixel Media, Chorus by ZoomInfo",15000000,101159675,Series B,21500000,2022-06-01T00:00:00+00:00,"","",false,false,false,false,"",697cf795e8d26c00019a505b,697cf795e8d26c00019a5104,"","","","","","","","","","","","",""
Bhushan,Talpade,Founder & CEO,BlueGrace Logistics,BlueGrace Logistics,bhushan@b2blabyrinth.com,Verified,Apollo,Apollo,"","",2026-01-27T11:52:45+00:00,Founder,C-Suite,wmarceau@marceausolutions.com,"","","",'+1 800-697-4477,"",Cold,"","",wmarceau@marceausolutions.com,760,logistics & supply chain,"less than truckload, expedited & guaranteed shipping, truckload, enterprise solutions, international shipping, air & ocean freight, supply chain management, freight forwarder services, transportation technology, transportation management, refrigerated transport, logistics, transportation, logistics, supply chain & storage, logistics growth, digital freight matching technology, prescriptive analytics, logistics partnership, freight booking, refrigerated freight, freight analytics, esg logistics, freight claims management, logistics data, nmfc classification, 3pl, predictive freight analytics, freight management platform, freight management software, logistics digitalization, freight consolidation, supply chain transparency, logistics innovation, managed logistics, logistics operations, freight insurance, logistics integration, operational efficiency, logistics network optimization, freight density calculation, intermodal logistics, b2b, supply chain analysis, blueship platform, services, drop trailer programs, sustainable logistics practices, technology-driven logistics, carrier benefits, intermodal shipping, freight class determination, temperature-sensitive freight, logistics franchise, supply chain visibility, ltl, supply chain whitepapers, supply chain reporting, carrier network, e-commerce, asset-light logistics, industry-specific logistics, perishable goods logistics, customer service, logistics technology, digital freight matching, supply chain analytics, general warehousing and storage, ocean freight, ltl shipping, freight brokerage, logistics industry, freight cost management, logistics platform, packaging for ltl, freight class calculator, temperature-controlled freight, freight optimization, carrier safety standards, supply chain solutions, supply chain, freight transportation, cross-border freight, freight management, supply chain webinars, supply chain analytics tools, freight density optimization, freight capacity management, predictive analytics, logistics automation, ocean and air freight, logistics industry recognition, truckload shipping, logistics podcasts, intermodal, freight cost reduction, supply chain optimization, prescriptive supply chain, carrier onboarding, logistics software, private equity logistics, transportation management system, freight forwarding, carrier relationships, freight tracking, logistics services, supply chain case studies, freight claims, esg reporting in logistics, supply chain efficiency, customer experience, logistics consulting, retail, 3pl logistics, freight rate engine, air freight, cross-border logistics, supply chain resilience, logistics network, logistics industry awards, supply chain sustainability, supply chain innovation, supply chain consulting, third party logistics, less-than-truckload, full truckload, cross-border shipping, blueship tms, inventory optimization, automated logistics, freight carriers, logistics analytics, sustainability reporting, freight cost analysis, actionable data insights, shipping integrations, real-time tracking, shipping quotes, freight class calculations, density calculator, streamlined logistics, load matching, logistics support, route optimization, customer logistics partnerships, cutting-edge logistics technology, network optimization, transportation consolidation, logistics insights, service level agreements, logistics outsourcing, custom logistics solutions, logistics risk management, transparent pricing, healthcare, manufacturing, distribution, consumer_products_retail, logistics & supply chain, consumer internet, consumers, internet, information technology & services, enterprise software, enterprises, computer software, health care, health, wellness & fitness, hospital & health care, mechanical or industrial engineering",http://www.linkedin.com/in/bhushan-talpade-7329998,https://mybluegrace.com,http://www.linkedin.com/company/bluegrace-logistics,https://www.facebook.com/bluegracelogistics,https://twitter.com/mybluegrace,Mumbai,Maharashtra,India,"2846 South Falkenburg Road, Riverview, Florida, United States, 33578",Riverview,Florida,United States,'+1 800-697-4477,"Cloudflare DNS, Listrak, Mimecast, CloudFlare Hosting, Mailchimp Mandrill, Outlook, MailChimp SPF, Microsoft Office 365, Google Cloud Hosting, Amazon AWS, WP Engine, React, Microsoft Sharepoint, The Trade Desk, Salesforce Live Agent, Hubspot, Salesforce, Slack, Active Campaign, Media Temple SSL, iCIMS, Oracle Cloud, Remote, Outreach, OneTrust Tech Risk & Compliance, Linkedin Marketing Solutions, Gem",352000000,255000000,Merger / Acquisition,0,2020-03-01T00:00:00+00:00,"","",false,false,false,false,"",697cf795e8d26c00019a506b,697cf795e8d26c00019a5103,"","","","","","","","","","","","",""
Clara,Dillie,Owner Operator,Forward Air Corporation,Forward Air,cdillie@forwardair.com,Verified,Apollo,Apollo,"",Catch-all,2026-01-30T18:25:29+00:00,Owner,"",wmarceau@marceausolutions.com,"","","",'+1 800-726-6654,"",Cold,"","",wmarceau@marceausolutions.com,6400,transportation/trucking/railroad,"transportation, shipping, pool distribution services, freight management services, ltl, 3pl, linehaul, intermodal, cartage, airline logistics, truckload, driver jobs, owner operators, truck drivers, trucking jobs, coldchain, temperature controlled, integrated freight & logistics, industrials, truck transportation, shipping compliance, automotive supply chain, supply chain management, digital logistics tools, transport solutions, retail supply chain, shipping reliability, industrial freight services, transport network, edi integration, supply chain risk management, logistics industry, shipping technology, heavy machinery transport, logistics technology, billing and management systems, transportation services, specialized cargo handling, green logistics practices, shipping cost management, community engagement, full truckload, pharmaceutical logistics, cost-effective shipping, transportation network optimization, hazardous materials logistics, warehouse automation, integrated logistics services, fleet operations, shipping solutions, freight forwarding, veteran employment programs, shipping optimization, cost reduction strategies, technology-driven logistics, last mile delivery, intermodal logistics, transportation & logistics, multi-modal transportation, just-in-time delivery, supply chain efficiency, large volume freight, perishable cargo management, customized freight solutions, customized logistics planning, intermodal drayage, cargo safety, fleet management, supply chain solutions, time-sensitive shipping, north american logistics, cargo insurance, warehousing & distribution, cost-effective freight solutions, safety protocols, ground transportation, freight solutions, logistics innovation, logistics software, custom freight solutions, real-time tracking, intermodal services, community support initiatives, transport scheduling, freight capacity planning, expedited ltl, real-time shipment tracking, time-definite delivery, truckload services, final mile delivery, transport safety standards, medical equipment shipping, time-definite surface shipping, fleet maintenance, warehouse network, freight brokerage, general freight trucking, long-distance, supply chain visibility, logistics solutions, customer-centric logistics, intermodal container handling, sustainable transportation, ltl shipping, freight management, supply chain resilience, expedited freight services, cargo tracking, specialized freight handling, shipping industry, fleet tracking systems, perishable goods transportation, automotive logistics, carrier partnerships, transport services, customer service, cost efficiency, driver safety, logistics for retail industry, sustainable logistics, logistics analytics, supply chain logistics, logistics management, carrier network, urgent freight services, freight & shipping, shipping documentation, freight shipping, expedited shipping, ltl services, truckload solutions, intermodal transport, brokerage services, multi-modal delivery, scheduling services, routing optimization, freight tracking, shipping quotes, delivery management, custom shipping solutions, intact delivery rates, north american transportation, warehouse services, e-commerce shipping, industry-specific transport, sustainability initiatives, veteran support programs, transportation cost savings, on-time delivery, warehouse management system, customer service support, risk management, efficient transportation, long-haul shipping, regional delivery solutions, national coverage, freight handling services, automated shipment tracking, route planning, cargo insurance options, asset-based transportation, owner-operator partnerships, b2b shipping solutions, claims handling, b2b, e-commerce, healthcare, non-profit, manufacturing, distribution, consumer products & retail, logistics & supply chain, transportation/trucking/railroad, consumer internet, consumers, internet, information technology & services, health care, health, wellness & fitness, hospital & health care, nonprofit organization management, mechanical or industrial engineering",http://www.linkedin.com/in/clara-dillie-97892013,https://forwardair.com,http://www.linkedin.com/company/forward-air,https://facebook.com/drivefaf/,https://twitter.com/faf_inc,Fort Worth,Texas,United States,"1915 Snapps Ferry Rd, Greeneville, Tennessee, United States, 37745-3516",Greeneville,Tennessee,United States,'+1 800-726-6654,"Microsoft Azure Hosting, Outlook, Microsoft Office 365, Amazon AWS, Oracle Cloud, Salesforce Service Cloud, Salesforce, Salesforce Live Agent, Drupal, Slack, Vimeo, iGoDigital, Google Maps, Google Tag Manager, Google Places, Google Dynamic Remarketing, Cedexis Radar, Shutterstock, Ruxit, DoubleClick, Adobe Media Optimizer, Mobile Friendly, Google Font API, DoubleClick Conversion, Apache, ON24, Google Analytics, Google Maps (Non Paid Users), Remote, IoT, Microsoft Excel, Node.js, TypeScript, PostgreSQL, Oracle Analytics Cloud, Microsoft Sql Server, Docker, Kubernetes, Azure Functions, Azure Container Apps, Azure Service Bus, Azure Devops, PowerBI Tiles, SAP, Spiceworks IP Scanner, Microsoft PowerPoint, Qualcomm Snapdragon, Google Ads, DHL Global Forwarding, Omniture (Adobe), 24-7 Media, Rapid7 InsightVM, Tampa AS400 Inc, MEX Maintenance Software, Salesforce CRM Analytics, Microsoft Intune Enterprise Application Management, Microsoft Azure Monitor, Microsoft Exchange Server 2003, WMS, Atlas, Microsoft Office",2474262000,"","","","","","",false,false,false,false,3,697cf795e8d26c00019a507b,697cf795e8d26c00019a50de,truckinggmas@aol.com,Apollo,Verified,Apollo,"","","","","","","","",""
John,Higgins,Chief Executive Officer,Bluegrass Supply Chain,Bluegrass Supply Chain,jhiggins@bsc3pl.com,Verified,Apollo,Apollo,"","",2026-01-14T15:39:11+00:00,C suite,C-Suite,wmarceau@marceausolutions.com,"","","",'+1 270-282-2211,"",Cold,"","",wmarceau@marceausolutions.com,320,logistics & supply chain,"reverse logistics, value added warehousing, omnichannel fulfillment, manufacturing support, transportation management, transportation, logistics, supply chain & storage, warehousing and storage, real-time shipment visibility, b2b, just-in-sequence fulfillment, supply chain optimization, value-added warehousing, order fulfillment, supply chain solutions, technology-driven logistics, flexible logistics solutions, repack/export pack, supply chain automation, lean management principles, autonomous mobile robot (amr) technology, retail, scalable operations, contract packaging, general warehousing and storage, technology integration, customer experience, warehousing, operational efficiency, market access, worker safety, logistics and supply chain management, amr technology, customer loyalty enhancement, inventory synchronization, scalability, market expansion support, demand fluctuation management, services, b2c, error reduction, inventory optimization, capacity management, logistics, e-commerce, customer satisfaction, sustainability in logistics, supply chain management, d2c, just-in-time fulfillment, cost reduction, distribution, logistics & supply chain, warehousing & storage, consumer internet, consumers, internet, information technology & services",http://www.linkedin.com/in/john-higgins-b835ba7,https://bsc3pl.com,http://www.linkedin.com/company/bluegrass-supply-chain-services,https://www.facebook.com/bluegrasssupplychain/,https://twitter.com/BluegrassSCS,Bowling Green,Kentucky,United States,"360 8th Ave, Bowling Green, Kentucky, United States, 42101-2135",Bowling Green,Kentucky,United States,'+1 270-282-2211,"Outlook, Amazon AWS, MailJet, Sage Intacct, Slack, Facebook Widget, Mobile Friendly, Facebook Custom Audiences, Facebook Login (Connect), Vimeo, Google Tag Manager, AI",123100000,"","","","","","",false,false,false,false,"",697cf795e8d26c00019a5059,697cf795e8d26c00019a5102,"","","","","","","","","","","","",""
Jamal,Lawson,Owner Operator,Hub Group,Hub Group,jlawson@hubgroup.com,Extrapolated,Apollo,Apollo,0.59,"","",Owner,"",wmarceau@marceausolutions.com,"","","",'+1 630-271-3600,"",Cold,"","",wmarceau@marceausolutions.com,6400,transportation/trucking/railroad,"multimodal solutions, logistics, intermodal, trucking, final mile, managed solutions, transportation, international solutions, 3pl, lessthantruckload, brokerage, transportation management systems, integrated freight & logistics, industrials, truck transportation, b2b, digital freight solutions, transport safety, safety and fleet maintenance, automotive logistics, asset utilization optimization, less-than-truckload (ltl), supply chain transparency, sustainable logistics practices, supply chain risk management, international freight forwarding, asset-based transportation, ltl freight, international freight solutions, dedicated trucking, temperature-controlled freight, asset-based logistics, truck brokerage, intermodal transportation, intermodal logistics, transport optimization, railcar management, e-commerce, cost-effective intermodal, shipping solutions, automated freight matching, temperature-sensitive cargo, private fleet management, logistics software, intermodal container tracking, warehousing and distribution, cross-border transportation, warehousing, private fleet, real-time analytics, digital supply chain, last mile delivery, industry partnerships, e-commerce fulfillment, inventory management, asset-based trucking, automated freight management, supply chain technology, cloud logistics solutions, technology-driven logistics, asset solutions for 3pls, global shipping, real-time shipment visibility, freight cost optimization, dedicated fleet, reverse logistics, carrier network, last-mile delivery, retail supply chain, visibility platform, international shipping, temperature-controlled intermodal, private fleet logistics, supply chain optimization, logistics management, freight & shipping, temperature-controlled containers, full truckload (ftl), logistics innovation, retail logistics, supply chain visibility, global freight forwarding, logistics network, railcar management system, global freight, multi-modal transportation, transportation management system, technology platform, fleet management, general warehousing and storage, ai in logistics, retail, supply chain sustainability, real-time shipment tracking, carrier relationships, reverse logistics services, gps tracking, fleet safety technology, supply chain digitalization, fleet safety, supply chain management, cost-effective transportation, fleet maintenance, reverse logistics solutions, sustainable transportation, freight management, supply chain automation, services, customer service excellence, automotive supply chain, rail and truck integration, cross-border logistics, healthcare, transportation network, cross-border freight, full truckload, consulting, third-party logistics, supply chain resilience, freight optimization, e-commerce logistics solutions, full-service logistics provider, integrated supply chain, order fulfillment, cost efficiency, supply chain analytics, sustainability, cost reduction strategies, data-driven insights, freight consolidation services, cross-border shipping solutions, asset management, sustainable logistics, freight brokerage, rail logistics, safety protocols, warehousing solutions, third-party logistics (3pl), freight forwarding, last mile delivery technology, freight cost control, e-commerce logistics, carrier network management, fleet tracking, transportation & logistics, supply chain solutions, specialized equipment logistics, shipment tracking, logistics solutions, temperature-controlled logistics, marine container solutions, less-than truckload (ltl), final mile delivery, parcel management, ltl freight services, safety regulations, logistics technology, consolidation services, international freight shipping, parcel solutions, customized services, emergency freight services, expedited shipping, drayage services, high-value freight, healthcare logistics, food & beverage logistics, chemical logistics, 3pl services, sustainability practices, corporate social responsibility, warehouse management, freight visibility, logistics insights, on-time delivery, cost-effective solutions, transloading services, freight transportation, custom logistics solutions, carrier management, supply chain insights, manufacturing, distribution, consumer_products_retail, transportation_logistics, transportation/trucking/railroad, consumer internet, consumers, internet, information technology & services, logistics & supply chain, health care, health, wellness & fitness, hospital & health care, environmental services, renewables & environment, mechanical or industrial engineering",http://www.linkedin.com/in/jamal-lawson-b06824172,https://hubgroup.com,http://www.linkedin.com/company/hub-group,https://www.facebook.com/HubGroupInc/,https://twitter.com/hubgroup,Philadelphia,Pennsylvania,United States,"2000 Clearwater Dr, Oak Brook, Illinois, United States, 60523-8809",Oak Brook,Illinois,United States,'+1 630-271-3600,"Route 53, Outlook, Microsoft Office 365, Gmail, Google Apps, Rackspace MailGun, Pardot, OneTrust, Appcues, MongoDB, Slack, Hubspot, Pantheon, Atlassian Cloud, VueJS, Amazon SES, Mobile Friendly, Bootstrap Framework, reCAPTCHA, Google Font API, Google Maps, CrazyEgg, Google Maps (Non Paid Users), Typekit, Google Analytics, Gravity Forms, WordPress.org, Google Tag Manager, Simpli.fi, Linkedin Marketing Solutions, DoubleClick Conversion, DoubleClick, Google Dynamic Remarketing, Remote, Micro, Domo, AI, Gem, Omnitracs XRS, Microsoft Office, Google AdWords Conversion, Microsoft Excel, Microsoft Access, Microsoft Project, Microsoft PowerPoint, Salesforce, Oracle Cloud, REACH, Salesforce CRM Analytics, accessiBe, OpenProject, Tenstreet",3946390000,"","","","","","",false,false,false,false,"",697cf795e8d26c00019a5065,697cf795e8d26c00019a50e5,"","","","","","","","","","","","",""
